{
  "danger_signs": {
    "convulsing_now": false,
    "had_convulsions": false,
    "lethargic_or_unconscious": false,
    "unable_to_drink_or_breastfeed": false,
    "vomits_everything": false
  },
  "diarrhoea": null,
  "ear": null,
  "fever": null,
  "patient_facts": {
    "age_months": 18,
    "has_cough_or_difficult_breathing": false,
    "has_diarrhoea": false,
    "has_ear_problem": false,
    "has_fever": false
  },
  "respiratory": null
}
